{
  "id": "crime-wave",
  "name": "Crime Wave",
  "tier": "DISCONTENT",
  "description": "A wave of petty thefts and vandalism sweeps through the settlements.",
  "percentileMin": 21,
  "percentileMax": 30,
  "skillOptions": [
    {
      "skill": "intimidation",
      "successEffect": "Crime suppressed, no effect",
      "failureEffect": "Lose 1d4 Gold",
      "criticalFailureExtra": "Lose 2d4 Gold, +1 Unrest"
    },
    {
      "skill": "thievery",
      "successEffect": "Infiltrate gangs, crime suppressed",
      "failureEffect": "Lose 1d4 Gold",
      "criticalFailureExtra": "Lose 2d4 Gold, +1 Unrest"
    },
    {
      "skill": "society",
      "successEffect": "Legal reform prevents crime",
      "failureEffect": "Lose 1d4 Gold",
      "criticalFailureExtra": "Lose 2d4 Gold, +1 Unrest"
    },
    {
      "skill": "occultism",
      "successEffect": "Divine the source, crime prevented",
      "failureEffect": "Lose 1d4 Gold",
      "criticalFailureExtra": "Lose 2d4 Gold, +1 Unrest"
    }
  ]
}
