{
  "id": "riot",
  "name": "Riot",
  "tier": "TURMOIL",
  "description": "Angry mobs riot in the streets, destroying property.",
  "percentileMin": 61,
  "percentileMax": 69,
  "skillOptions": [
    {
      "skill": "intimidation",
      "successEffect": "Riot quelled, no effect",
      "failureEffect": "+1 Unrest, 1 structure damaged",
      "criticalFailureExtra": "+1 Unrest, 1 structure destroyed"
    },
    {
      "skill": "diplomacy",
      "successEffect": "Negotiation succeeds, no effect",
      "failureEffect": "+1 Unrest, 1 structure damaged",
      "criticalFailureExtra": "+1 Unrest, 1 structure destroyed"
    },
    {
      "skill": "athletics",
      "successEffect": "Riot contained, no effect",
      "failureEffect": "+1 Unrest, 1 structure damaged",
      "criticalFailureExtra": "+1 Unrest, 1 structure destroyed"
    },
    {
      "skill": "medicine",
      "successEffect": "Injured treated, tensions ease, no effect",
      "failureEffect": "+1 Unrest, 1 structure damaged",
      "criticalFailureExtra": "+1 Unrest, 1 structure destroyed"
    }
  ]
}